{
  "provenance_version": "1.0",
  "source_bindings": [
    {
      "binding_version": "1.0",
      "source_result_id": "source-result-7a1629eeed909c10fb0c638c51359437c97f2aa03a48af12e5d690f1db3a13ab",
      "logical_source_id": "source-manual-001",
      "source_content_digest": "sha256:aaaaaaaaaaaaaaaaaaaaaaaaaaaaaaaaaaaaaaaaaaaaaaaaaaaaaaaaaaaaaaaa",
      "source_blob_locator": "blobs/sha256/aa/aaaaaaaaaaaaaaaaaaaaaaaaaaaaaaaaaaaaaaaaaaaaaaaaaaaaaaaaaaaaaaaa",
      "source_descriptor_digest": "sha256:4ddf576bbb0d317218e6a89cd553dcf99164de0628d7f04407cf13f2e4e14449",
      "source_descriptor_locator": "namespaces/example/source-results/source-manual-001/source-result-7a1629eeed909c10fb0c638c51359437c97f2aa03a48af12e5d690f1db3a13ab.json",
      "source_contract": {
        "id": "source_admission.v1",
        "version": "1.0.0"
      },
      "source_phase_receipt": {
        "run_id": "run-source-001",
        "receipt_digest": "sha256:eeeeeeeeeeeeeeeeeeeeeeeeeeeeeeeeeeeeeeeeeeeeeeeeeeeeeeeeeeeeeeee"
      }
    }
  ],
  "producer": {
    "kind": "tool",
    "identifier": "producer.example",
    "version": "1.2.0"
  },
  "transformation": {
    "identifier": "transform.extract-v1",
    "version": "1.0.0",
    "parameters_digest": "sha256:ffffffffffffffffffffffffffffffffffffffffffffffffffffffffffffffff"
  }
}
